{
  "schemaFormatVersion": "1.0.0",
  "clientId": "default",
  "themeVersion": 1,
  "colors": {
    "light": {
      "primary": "#2563EB",
      "secondary": "#64748B",
      "accent": "#F59E0B",
      "background": "#FFFFFF",
      "surface": "#F8FAFC",
      "card": "#FFFFFF",
      "border": "#E2E8F0",
      "textPrimary": "#0F172A",
      "textSecondary": "#475569",
      "placeholder": "#94A3B8",
      "success": "#16A34A",
      "warning": "#F59E0B",
      "danger": "#DC2626",
      "info": "#0EA5E9",
      "separator": "#E2E8F0",
      "overlay": "#0F172A99",
      "skeleton": "#E2E8F0",
      "loading": "#2563EB",
      "selection": "#DBEAFE",
      "navigation": "#FFFFFF",
      "toolbar": "#FFFFFF",
      "tabBar": "#FFFFFF",
      "glass": "#FFFFFFCC",
      "material": "#F1F5F9",
      "interactive": "#2563EB",
      "badge": "#DC2626",
      "favorite": "#E11D48",
      "online": "#16A34A",
      "offline": "#94A3B8"
    },
    "dark": {
      "primary": "#3B82F6",
      "secondary": "#94A3B8",
      "accent": "#FBBF24",
      "background": "#0B1220",
      "surface": "#111827",
      "card": "#1E293B",
      "border": "#334155",
      "textPrimary": "#F8FAFC",
      "textSecondary": "#CBD5E1",
      "placeholder": "#64748B",
      "success": "#22C55E",
      "warning": "#FBBF24",
      "danger": "#EF4444",
      "info": "#38BDF8",
      "separator": "#334155",
      "overlay": "#00000099",
      "skeleton": "#1E293B",
      "loading": "#3B82F6",
      "selection": "#1E3A8A",
      "navigation": "#111827",
      "toolbar": "#111827",
      "tabBar": "#111827",
      "glass": "#1E293BCC",
      "material": "#1E293B",
      "interactive": "#3B82F6",
      "badge": "#EF4444",
      "favorite": "#FB7185",
      "online": "#22C55E",
      "offline": "#64748B"
    }
  },
  "typography": {
    "fontFamily": "Inter",
    "scale": {
      "largeTitle": { "size": 34, "weight": "bold", "lineHeight": 41 },
      "title1": { "size": 28, "weight": "bold", "lineHeight": 34 },
      "title2": { "size": 22, "weight": "semibold", "lineHeight": 28 },
      "headline": { "size": 17, "weight": "semibold", "lineHeight": 22 },
      "body": { "size": 17, "weight": "regular", "lineHeight": 22 },
      "subheadline": { "size": 15, "weight": "regular", "lineHeight": 20 },
      "caption": { "size": 12, "weight": "regular", "lineHeight": 16 },
      "footnote": { "size": 13, "weight": "regular", "lineHeight": 18 }
    }
  },
  "shape": {
    "cornerRadiusSmall": 4,
    "cornerRadiusMedium": 8,
    "cornerRadiusLarge": 16
  }
}
